{
 "schema_version": 1,
 "id": "gray-2017.09",
 "soc": "esp32",
 "populated": false,
 "buses": {
  "i2c_internal": {
   "kind": "i2c",
   "pins": {
    "sda": "G21",
    "scl": "G22"
   },
   "src": [
    "m5-gray"
   ],
   "confidence": "high",
   "last_verified": "2026-09-26"
  }
 },
 "connectors": [],
 "pins": {},
 "notes": "Not yet populated: GPIO uses, claims and connectors are TODO for the implementation backlog. Only the bus pins below are sourced. The IP5306 is not on I2C in this wiring.",
 "src": [
  "m5-gray"
 ],
 "confidence": "high",
 "last_verified": "2026-09-26"
}
